сатанинская библия; (решение санкт-петербургского городского суда от 22.08.2024).
кто же отклонился?!
московська отрута;фоп стебеляк о.м.
российско-украинская война: возвращение истории;the russo-ukrainain war
жадання фронту. позивний ;;вожделение фронта. позывной ;), мельник м.ю., издательство ;, г. киев, 2017 (решение верховного суда донецкой народной республики от 10.07.2024).
сэнсэй-iv. исконный шамбалы;пролог голос утих. но не прошло и несколько мгновений, как…;но только для тех, кто своими мыслями и делами обретает высшее, конец становится началом.
храм крови;temple_ov_blood
черная книга сатаны iii;черная книга сатаны;the black book of satan
caelethi черная книга сатаны ii;черная книга сатаны;the black book of satan
черная книга сатаны i;черная книга сатаны;the black book of satan
на гранi вiчного болю;видавництво ; 2018 (решение ильичевского районного суда г. мариуполя днр от 12.02.2024).
к десятилетию кёнделенского противостояния 14-17 сентября 2008 г.;вестник балкарского народа
исполнительного комитета совета народных депутатов г. красноярска;рфия- псевдо государство, преступно действующая на территории нашей страны – ссср, должна в кратчайшие сроки прекратить свое существование!;нужны кардинальные меры по решению данного вопроса, вплоть до силовых методов в отношении незаконного действующего жидовского правительства рф! за свободу; (решение кировского районного суда г. красноярска красноярского края от 07.11.2023).
протокол регистрации преступления на территории ссср в военное время представителем нелегитимных структур для последующей передачи в военный трибунал ссср
нота генеральному секретарю оон
требование о возврате в исходное состояние всего, что было на территории башкирской асср в составе рсфср до совершения преступления
тезисы к плану развития нашей державы
уведомление ; (апелляционное определение судебной коллегии по административным делам верховного суда республики башкортостан от 31.01.2022 и кассационное определение судебной коллегии по административным делам шестого кассационного суда общей юрисдикции от 01.06.2022).
выписка из приказа открытого выездного заседания военной коллегии верховного суда союза советских социалистических республик
глава башкирской автономной советской социалистической республики в составе российской советской федеративной социалистической республики. о вступлении в должность врио главы башкирской асср в составе рсфср. врио гаранта устава башкирской асср в составе рсфср
предостережение гражданина ссср о недопустимости преступления лицом рф
маздакиты на кавказе
гордый мальчик, русый, сероглазый,…;и того, что в этом сила, брат.
право на фашизм;давно зовут иуды-журналисты…;будет вам награда за труды!
офицеру-националисту;если мы покоримся, страну обречем,…;с медальоном ss ты идешь вдоль домов
русскому скинхеду;застыла россия в разрухе и голоде,…;за белые дни…
мы здесь;сердце рунами ; пронизала гроза,…;вы не ждали, а мы уже здесь.
россия – бесполезная страна…;россия останавливать не станет.
доба нацiоналiзму;цивiльного корпусу ; (решение буденновского межрайонного суда города донецка донецкой народной республики от 24.03.2023).
двi революцii;цивiльного корпусу ; (решение буденновского межрайонного суда города донецка донецкой народной республики от 24.03.2023).
репост;клан белой крови;я люблю кавказ, но презираю тех, кто живет там. нигде в мире нет таких варварских обычаев и таких уродливых людей, как кавказцы, если мы не истребим их, эта грязь скоро окажется в наших городах. м.ю. лермонтов. но все почему – то запомнили ; (решение ленинского районного суда г. екатеринбурга от 31.03.2023).
это тебе не пионерский галстук. их заслужить надо
репост;клан белой крови;белые шнурки – элемент одежды правых нс – скинхедов, знак отличия и авторитета! их нельзя одеть просто так, их надо заслужить в битвах за расы и нацию!
скины: русь пробуждается
памятка пропагандиста.doc
скинхеды – интервью. doc
дмитрий честный – russianwill.doc
дмитрий честный – становление.doc
дмитрий честный – огонь!.doc
русский стяг – правильная речь
русским оккупантам;как вы будете драпать, с…ки!...;а в бомжи или в грузы 200 – это, с…ки, как повезет.
siege;осада
он не остановится, пока его не остановят;в феврале стало совершенно ясно…;…и не бояться ни штрафов ни тюрьмы. на кону наша жизнь;арсеньевские вести
декларация ; и дату ;, который начинается со слов: ; и заканчивается словами: ; (решение элистинского городского суда республики калмыкия от 02.06.2023).
иудаизм и масонство;кислород
тайна беззакония;родная страна
терновый венец россии;родная страна
ритуальные убийства;родная страна
россия и мировое зло;родная страна
евангелие от елизаветы;наследие;константа
европа отечеств. биополитическая цель национал-социализма;новая европа;, размещенные в иткс ; (решение центрального районного суда г. калининграда от 14.02.2023).
манифест национального сопротивления… на войне, как на войне. кремль уничтожает народ россии!;интернет
белая любовь;война поэта;в чертогах алого огня;карцер;пламенная надежда;жертва;если не ты то, кто же?;сон витязя;в гранитной пещере злой чародей;спас
начала мусульманской веры;издатель эжаев а.к.
науковi записки
христианский обман славян;христианский обман славян. официальной русской религией является христианство…;мусульманство — это протестанизм восточной христианской секты
роза серафитов. богомильское евангелие;блаженный иоанн;мир софии
программа м. к. у .;егор ; и ; (решение таганского районного суда г. москвы от 21.07.2022).
татары … это гордое имя/а.м. аминов. – казань: издательство ;, 2020. – 512 с.
ценой свободы;кирилл риддик;посвящается всем тем, кто прошел через стены испытаний..,;…мы безвозмездно отдаем себя и наши судьбы, изо дня в день, бросая вызов врагам. сердечно благодарю за помощь николая м. и к. вестейн
zashita_grazhdan_sssr.pdf;министерство юстиции ссср;соглашаясь подписывать любые документы, вы автоматически становитесь частью корпорации и теряете свободу и независимость, становясь рабом! с.в. тараскин
- сынок, через 70 лет твой президент будет евреем, и твоих внуков он будет сажать в тюрьму за антисемитские посты в контакте. в каждом городе мэр будет евреем. в каждом городе будет построен хасидский центр, в котором грязные евреи будут совершать свои кровавые ритуалы, а ты даже не будешь догадываться. твой народ будет вымирать со скоростью 1 миллион в год. ну а мы пока уходим… потому что мы проиграли, а ты выиграл. ты выиграл свое будущее…;интернет
интернет;одноклассники;абу мухаммад
no future;очередной тренд сезона – волна слухов о том, чем именно болен путин;начиняли самодельные взрывные устройства еще члены боевой организации партии социалистов-революционеров еще в 1904 году…
зачем митинг?;лучше митинг!;, заканчивающаяся словами ; (решение центрального районного суда г. барнаула алтайского края от 25.07.2022).
осетины на стороне третьего рейха. коллаборационизм в годы великой отечественной войны
распад империи – единственный выход;любые мечты о свободе, любые попытки цивилизаторства в россии…;все оккупационные российские войска будут выведены из всех колоний и соседних с россией стран
осинное гнездо кавказа
русская идея;жидов изгоняя все! во всем мире…всегда и везде…только в прошлом, 2-м тысячелетии, жидов изгоняли около 50-ти раз…в среднем, жидов изгоняли из чужих государств каждые 20-ть лет…и так продолжалось тысячу лет…народ жида гонит дверь, жид лезет в окно…и залез таки жид аж на самый на верх…что и ждал народ аж тысячу лет…чтобы скинуть жида аж на самое дно…изгнание жидов из россии;интернет
рябов анатолий аббасович. русский манифест;граждане! приближается то время, когда начнется уличная борьба…;… они возьмутся из ниоткуда – так же как в свое время взялись минин и пожарский
обращение народного депутата ссср ю.а. слепнёва к гражданам союза советских социалистических республик
евреи-начальники гулага;посмотрите на эти жидовские рожи.;враги всех народов, всего человечества;интернет
в коридоре тюремном я слышу шаги;но я знаю, что гибель моя – лишь начало
наци-соци: вопросы и ответы для национал-социалиста;10 заповедей национал-социалиста;свобода германии;родина – главная движущая сила твоей жизни. никогда не забывай это!;тогда мы сформируем новую германию – националистический, социалистический третий рейх!
ночь сварога;suncharion;предисловия;книга 1. предисловие. ; и заканчивающаяся словами ;, за исключением цитат из библии и танаха (решение звениговского районного суда республики марий эл от 15.02.2022).
россия и украина – небольшой ликбез по истории;к сожалению – русские довольно плохо знают свою историю. украинца, как правило – не знают ее совсем;хотите чтобы люди были о вас другого мнения – станьте другими…
российско-украинская война;на грузию в 2008 году русские вояки напали под шумок олимпиады в пекине;…туда и дорога!
герои нашего времени;их называют святыми. они-новые герои белой расы.;будьте готовы к любому исходу операции. все остальное зависит от вас.;интернет
исток ; в количестве 44 страниц (решение нальчикского городского суда кабардино-балкарской республики от 09.02.2022).
исток №1 ; в количестве 24 страниц (решение нальчикского городского суда кабардино-балкарской республики от 09.02.2022).
библия сатаны
из книги берл лазара ;, начинающийся со слов: ;ребе, я подумываю максимально увеличить миграцию гоев из средней азии и кавказа, дать зеленый свет китайцам и вьетнамцам, пустить их в одночасье и вручить им намного больше прав, чем русским гоям…;…так я никогда не ставил себя выше него, не затрагивая его амбиции, и между нами никогда не возникало недопониманий;интернет
jw library;общество сторожевой башни, библии и трактатов пенсильвании;общество сторожевой башни, библий, и трактатов, нью-йорк (решение октябрьского районного суда санкт-петербурга от 31.03.2021, апелляционное определение судебной коллегии по административным делам санкт-петербургского городского суда от 27.09.2021 и кассационное определение судебной коллегии по административным делам третьего кассационного суда общей юрисдикции от 20.04.2022).
аль - ваъй;интернет
озарение;абу мансур руси;абу ахмад дагестани
новый мировой порядок/new word order
женщина в берлине. дневник - с 20 апреля по 22 июня 1945 года;да, война подкрадывается к берлину…;…возможно, мы с ним еще найдем дорогу друг к другу.
der untermensch/недочеловек;пока на земле существуют люди, борьба между человеком и недочеловеком будет историческим правилом;европа, защити себя!
русня! в стойло!
инструкция бто;инструкция бто…;…чтобы бойцы бто смогли отразить репрессии;интернет
справедливости нет, потому что вранье кругом! и виноваты во всем только раввины и евреи;то, что во всем виноваты раввины и евреи я сейчас легко докажу как математическую теорему;5 декабря 2018 г. мурманск. антон благин
этот текст о герое михаиле жлобицком мы опубликовали год назад;что можно сказать о атаке в архангельске;вечная память герою!
азбука свободы;это книга о свободе…;…но боялись (у него же) спросить
облегчение от великодушного и милостивого
отчет русским богам ветерана русского движения;белые альвы;эту книгу я пишу для себя. сказанное отнюдь не означает, что автор категорически отказывается от возможности увидеть ее напечатанной…;… я молю наших богов только об одном. чтобы победили вы. с нами бог!
мифы патриотов;великая война: правда против вымысла;розовый туман;расизм по-русски;ступени к победе


ценой свободы 2;из по покрова тьмы ночной…;…признателен за вклад каждого из вас!

владимирская русь;владимирская офсетная типография; (решение йошкар-олинского городского суда республики марий эл от 29.10.2020).
нелегальная молодость. арийская антиутопия;в 2010-2015 годах территорию россии захлестнула волна межнациональных конфликтов;и стоит в оппозиции ко всему остальному устаревшему мiру. all be back
шаг к истине;эльбрус между адыгами и карачаевцами
пути к победе
ave satan - legion;зачем нужен сатанизм? пункт первый. внутренний мир.;а дети все работают лет с восьми и самодостаточны.
эздел – формула земной и вечной жизни;когда аллах создал землю, ее поверхность была очень мягкой, похожей на болотистую почву, она кипела и пузырилась, как кипящая смола…;святой кунта-хаджи говорил: ; (решение заводского районного суда г. грозного чеченской республики от 08.07.2020).
осетины на службе третьего рейха. факты массового сотрудничества осетин с фашистами в годы великой отечественной войны
вечная религия природы;посвящается моему народу;, заканчивающаяся словами ;, на 505 листах (решение левобережного районного суда города липецка от 20.08.2020).
что такое хорошо и что такое плохо;крошка сын к отцу пришел…;… с головой их обличают грязные делишки!
девяностые, геноцид русских в чечне;нулевые, геноцид русских в россии;чернильницы. им по…й они улучшают генофонд кавказцев
таухид детям. книга 1;taukhid_detyam_kniga_1.doc;, перевод с арабского языка: дамир хайруддин 1431 год хиджры/2010 год, за исключением сур, аятов и цитат из корана (решение кировского районного суда города уфы от 08.07.2020).
игил – это неотъемлемая часть всего ислама;вы слышали, что сказано: люби ближнего твоего и ненавидь врага твоего;чтобы найти истину, иногда кому-то нужно сначала понять, где ее нет;душа – встреча с господом;советская сибирь
еврейский вопрос глазами американца;еврейский вопрос еще так и не вызрел в россии…;…россия явно созревает для того, чтобы включиться в процесс борьбы, разворачивающийся во всех странах, познавших еврейское владычество
православие или смерть;институт русской цивилизации
бомбер;от заточки и дубинки защищать всегда готов …;мама быстро отстирает кровь чурека с рукавов
вести и следовать;фюрер! отдай приказ - мы выполним его!;готовые к смерти за отечество, приветствуют тебя, адольф гитлер!
ренессанс. rahowa будет существовать до тех пор, пока горят огни в ее прогнившем мире!
ренессанс. когда преступником становится государство - право быть судьей принадлежит каждому гражданину
ренессанс. фашизм не пройдет пройдет национал-социализм
программа ;, начинающаяся словами: ;норна;мы настроены на результат! мы настроены на победу!
форпост;, политсовет демократический союз ингушетии ; (справедливость), тираж 500 экз., содержащая 140 страниц печатного текста (решение магасского районного суда республики ингушетия от 02.03.2020).
борьба за существование белой расы;расовый реализм (racial realism) - это не историческая и не социальная, а сугубо биологическая категория;русские и американцы - товарищи по оружию в этой великой борьбе за будущее нашего народа; (решение сыктывкарского городского суда республики коми от 22.06.2020).
